{
  "schema_version": "0.1",
  "language": "python",
  "base": { "revision": "9f1c0a3d5e7b2f4a6c8d0e2f4a6b8c0d2e4f6a80" },
  "mutants": [
    {
      "id": "3b1f8c2d4e6a8b0c2d4e6f8a0b2c4d6e8f0a2b4c6d8e0f2a4b6c8d0e2f4a6b8c",
      "file": "src/scheduling/overlap.py",
      "base_file_sha256": "7d2e4f6a8b0c2d4e6f8a0b2c4d6e8f0a2b4c6d8e0f2a4b6c8d0e2f4a6b8c0d2e",
      "span": { "start_byte": 412, "end_byte": 431 },
      "original": "start < other.end",
      "replacement": "start <= other.end",
      "description": "Treat touching intervals as overlapping.",
      "provenance": { "model": "example", "prompt_version": "1" }
    }
  ]
}
